480;Turkish Police Clash with Kurds – James Corbett on PressTV http://t.co/g2XZArrM The Corbett Report;NO
481;BBC News UK Shot wife 'killed with own gun': The wife of a Norfolk council leader believed to have been killed b... http://t.co/JWydNXTB;shooting
482;One dead after stabbing in Olympia: OLYMPIA – One person is dead and two others are injured after an early morning... http://t.co/qTRHhxJy;shooting
483;Correction:  One dead, one injured in Olympia stabbing.;shooting
484;Police: Argument leads to man's death: Daytona Beach police are investigating a homicide after an argument left ... http://t.co/qLVl8iXY;NO
485;1 killed, 1 injured in Olympia tavern stabbing: One person has been killed and one injured in a stabbin... http://t.co/EQ1NsqMU #seattle;shooting
486;Shots fired at 2 Seattle University District businesses. man arrested • http://t.co/kFhR7IWe;shooting
487;My basic plan was to start the story with an explosion and end with an even bigger explosion in MAD SCIENCE INSTITUTE http://t.co/hUCyrG1V;NO
488;Better Writing: To beat writer’s block, improve on something you finished long ago. Make new scenes. It’ll get your brain in gear. #writetip;NO
489;Stalled truck NB I5 at the Boeing Access Road blocking the TWO left lanes!;crash
490;City defies warnings, merges fire, police depts.: By Justin Engel Michigan Live BAY CITY, Mich. — The ... http://t.co/5iOayUIS #FireNews;NO
491;BBC News UK MP breaks down over 'cold' nurses: An MP breaks down in tears as she describes the coldness, resent... http://t.co/eIp20EFx;NO
492;How Petraeus Quietly Stoked the Fires of Sectarian War Without Getting Burned http://t.co/VwOVsAgZ;NO
493;I know you told me break their hearts but its you I want to break apart;NO
494;To the idiot who's car alarm goes off for 60 seconds every time a bus or truck goes by. Hope you have a dead battery at the end of the day!;NO
495;Easily share reports with coworkers: http://t.co/zz3b5Yfz #mobile #reporting;NO
496;Police reports reveal new details in Belcher murder-suicide | ProFootballTalk (via http://t.co/PyF0Vo7J) http://t.co/vnqaAjD3;NO
497;Magician's hair catches fire on TV: HLN's A.J. Hammer reports on a magician Wayne Houchin, who was seriously bur... http://t.co/7cGwNnJ7;NO
498;Our Auto Locksmiths Are The Best! Automotive locksmith usually refers to opening of a locked car door when a... http://t.co/t25Fr5WB;NO
499;Seahawks would tie Giants common game tie break if finished 10-6 and 8-4 in NFC w Giants (Giants 4-1 and Seahawks 4-1) dal, car, sfo, gbp;NO
500;that awkward moment when you think you're having a fire drill at work.then you make it outside! & the effin fire trucks are pulling in ??;fire
501;it's not a fake one!! there's an electrical fire in my building & I left all my ish inside. Smh. ??;fire
502;Ballard's former art church to be torn down: Ballard's Art Church is about to go away. The old church... http://t.co/7a2Uowza #seattle;fire
503;stall reported, nb I-5 at Spokane St, blocking HOV;crash
504;I5 NB before the West Seattle Bridge, an accident is blocking the HOV lane!;crash
505;Man running from police hit by car in Richland: A man running from police was struck by a car and went ... http://t.co/cJzXcHmQ #seattle;crash
506;Man running from police hit by car in Richland: A man running from police was struck by a car and went through the... http://t.co/EBcVsbP8;crash
507;BBC News UK Woman dies in Castledawson crash: A 52-year-old woman has died in hospital following a traffic accid... http://t.co/oiVHNaEa;NO
508;An actress could be facing jail time after police claim she lied about not driving car during accident: http://t.co/X633iS7N;NO
509;I don't want to break any girls heart so I let her break mine;NO
510;NASA's MODIS program provides satellite views of in-progress fires and extent of damage by past fires. #AGU12 #NASASocial;NO
511;Free block, C Block;NO
512;Sunset to NB I-405, crash blocking right lane;crash
513;Roccos Block Land Free: Play the challenging Jump and Run game 'Rocco´s Block Land Free', on your Android device for... http://t.co/xpSuF03d;NO
514;Check out this 1999 Volvo 610 Highway Truck http://t.co/pVuDKD22 click for details;NO
515;#nowplaying Blackberry Smoke - Up In Smoke;NO
516;Man running from police hit by car in Richland: A man running from police was struck by a car and went ... http://t.co/vZx7JxKO #seattle;crash
517;tow truck w/stall, sb I-5 on ship canal, blocking right lane;crash
518;Police report shows new details in Jovan Belcher murder-suicide | Shutdown Corner - Yahoo! Sports http://t.co/VtkTy8za ( men, guns= terrible;NO
519;BREAKING: Wisconsin's Bret Bielema to be next Head Hog - KATV - Breaking News, Weather and Razorback Sports http://t.co/loAW8eqc;NO
520;“Yelling at living things does tend to kill the spirit in them. Sticks & stones may break our bones but words will break our hearts”Fulghum;NO
521;Past me was looking out for present me and burned some Built to Spill CDs and also left them in my moms car.;NO
522;Bellevue officers disciplined for incident at Seahawks game: Two Bellevue Police officers were discipli... http://t.co/IUrQUh9D #seattle;NO
523;just sitting here in a car dealership waiting for the dealership folk to get my car ready.;NO
524;The Wired Cars of the 2012 L.A. Auto Show | Autopia | http://t.co/k2QEwi2V http://t.co/iUqe8ZD6;NO
525;2012 Los Angeles Auto Show: Complete Coverage: The 2012 Los Angeles Auto Show opened this weekend, and Automotiv... http://t.co/yeyoJ6Yb;NO
526;2012 Los Angeles Auto Show: Studs and Duds: Our look at what's hot--and what's not--at the 2012 Los Angeles Auto Show. http://t.co/eE1eNDx2;NO
527;Galpin Auto Sports Plans to Build its Own Ford GT Successor: During the 2012 L.A. Auto Show, Galpin Auto Sports ... http://t.co/RtAU5eEG;NO
528;I voted early during the 2008 election to work on this road: Suiattle Road 'No Impact' Finding a Big Impact on Hikers http://t.co/jVGbzpdq;NO
529;Study: Electronic Stability Control Saved Over 2000 Lives From 2008 To 2010: A report from the National Highway ... http://t.co/8tUyqODg;NO
530;I just looked up and my neighbor's house was a different color. That was alarming.;fire
531;Auto Fire Alarm | 525 14th Av E | Units: E25 L10;fire
532;#Hannukah #Channukah #Car Yeah your race car driver buddy needs this! http://t.co/yJRD7WjJ  Open Source Racing Gear!!!;NO
533;Mr. Burns Explains the Fiscal Cliff: The sad thing is, his description of a driver who's willing to crash the c... http://t.co/ZYoN6oQH;NO
534;LOOK: Police Find Honest Shoppers In Sting Operation http://t.co/YK6ae6Bl;NO
535;Elite status nothing higher, I'm a UFO, Unidentified Flower, We outta space, Exclusive taste, Exclusive kicks, Everyday;NO
536;I didn't nearly stop my car to get a closer look at the handsome construction worker under the Ballard Bridge.  I stopped my car. #cool;NO
537;got my car back but i think i fucked up the tire on the loaner car. i feel awful :( #canthavenicethings;NO
538;1981 Porsche Turbo Cabriolet Exterior: White Interior: Black Stock #: 51210 VIN #: WP0ZZZ91ZFS151210... http://t.co/hmr1zgMd;NO
539;Automatic Fire Alarm Resd | 354 N 77th St | Units: E21;fire
540;BURN IT DOWN.seriously, we're lighting things on fire in the front yard. Giant Fire Pit&gt.Studying for My LOK interview.;NO
541;PostBusiness| Report: Suspect in fatal China fire angry over pay: Report: Suspect in fatal China fire angry over... http://t.co/acGWAVsL;NO
542;I am nonchalantly roasting marshmallows as the house burns #logic #ThugLife #;NO
543;Kent Police officer hailed a hero for saving teen's life: KENT – A Kent Police Officer is due to receiv... http://t.co/e4sKEqrx #seattle;NO
544;Auto Fire Alarm | 500 Wall St | Units: E2 L4;fire
545;Don't worry, be happy. xo #legalize #bobmarley #lyrics #quote #happy #smoke #seattle #blaze #celebrate #onel http://t.co/1FGMB9iM;NO
546;BBC News UK 'Critical' West Coast report due: A report into the failure of the tendering process for the West Co... http://t.co/vUZwD8Ik;NO
547;Vincent Van Gogh, why do you weep? You were on your way to heaven but the road was steep and who was there to break your fall? -S.M.;NO
548;Seattle Police officers given directive on marijuana enforcement: The Seattle Police Department told it... http://t.co/tLDwCdBL #seattle;NO
549;Agyekum Law Office - Seattle Top Injury & Car Accident Attorney on eBay Classifieds Seattle http://t.co/5PPxQbHH #eBayClassifieds;NO
550;most entertaining part was the guy that came and started grabbing up all the road blinkers the buckley fire department laid to direct trafic;NO
551;^^Or maybe a plastic recorder band. Or a very quiet car with very squeaky brakes driving around the block over and over.;NO
552;Street legal BMW M1 Pro Car with original pro car body kit.Like/Share http://t.co/273Ti4AW;NO
553;Grand Theft Auto IV: Save $1.09 on Grand Theft Auto IV 280 New and Used from: $12.49 List Price: $19.99 Amazon P... http://t.co/3ULbptPP;NO
554;Pre Order Grand Theft Auto V: Pre Order Grand Theft Auto V 1 New and Used from: $59.96 List Price: $59.99 Amazon... http://t.co/J3y23Btx;NO
555;Every year there are over 400 thousands house fires due to chimney fires.  Is your chimney safe to use? http://t.co/NqRJ1Uo4;NO
556;Tacoma police seek public’s help in finding boy charged with murder: TACOMA — Tacoma police are asking ... http://t.co/9M6kedBa #seattle;NO
557;Auto Fire Alarm | 4831 35th Av Sw | Units: L11;fire
558;Vanilla Reign: DuPont Says White is World’s Most Popular Car Color: In its annual Color Popularity Report, DuPon... http://t.co/xEbZ2GGl;NO
559;Better to be a speed bump than no bump at all. #Mariners  Trying to get something done to be better.;NO
560;Auto Fire Alarm | 3512 S Juneau St | Units: B5 E13 E30 L12;fire
561;She wanted me to show you her bump. no bruising appeared. http://t.co/wnS70nDS;NO
562;Slumping Ravens fire offensive coordinator Cameron: Cam Cameron has been fired as offensive coordinator of the... http://t.co/gZv5702y;NO
563;West Allis Police officers punched during scuffle: WEST ALLIS - Two police officers from West Allis were recover... http://t.co/zqsDPjUy;NO
564;DevJuice: iTC Daily Reports delivered to your inbox: While testing out Wevito's Daily Reports product, I had s... http://t.co/JDr9FAWQ;NO
565;Blazed #sonofagunart #sketch #sketchoftheday #skulls #snakes #blazed #blazednation #pinup http://t.co/8iqYpsuA;NO
566;these ratchet guys wanted my # so I gave them my ratchet friend's # loooooooooool;NO
567;Reports that Dez Bryant finger injury might be worse than thought.;NO
568;Family of four displaced after Redmond house fire: A large single family home went up in flames Monday ... http://t.co/CTz7la5r #seattle;fire
569;1 dead in Kitsap County house fire: One person died Monday in a house fire at Suquamish. http://t.co/fVNxUF0z;fire
570;PHOTOS: Safeway truck overturns, blocks road: A truck carrying goods for Safeway crashed Monday afterno... http://t.co/vOWKpPm0 #seattle;crash
571;Man opens fire near UW Book Store. suspect arrested: SEATTLE — Seattle police arrested a suspect Monday afternoon... http://t.co/ebCdXhaB;shooting
572;Man opens fire near UW Book Store. suspect arrested: SEATTLE — Seattle police arrested a suspect Monday... http://t.co/37fcNsPH #seattle;shooting
573;Man critically stabbed at Spokane apartment: Two men were injured, one critically, in a Monday night stabbing in... http://t.co/LXsBKHm0;shooting
574;Tech| Police want carriers to collect your texts: Here we go again. CNET reported on Monday that a group of law ... http://t.co/IzwzFr8w;NO
575;UK police arrest 6th person in sex abuse probe: LONDON (AP) — British police on Monday arrested another... http://t.co/5IidKEup #seattle;NO
576;REPORTED FIRE IN SINGLE FAMILY RES 100 NW 80TH ST 100 NW 80TH ST http://t.co/3a4phE1b;fire
577;Kindle Fire Sale on Fire! Amazon is offering $50 Discount on Kindle Fire HD 8.9, take your pick Wi-Fi or 4G LTE!  http://t.co/0LJ6vugz;NO
578;PostLifestyle| Bike, large truck deaths soar, bucking trend: Bike, large truck deaths soar, bucking trend Ass... http://t.co/POSSD403;NO
579;Ok babes I need yalls help block and report Ana_rose_s she's nothing but drama;NO
580;America, this is your news reporting: What are kittens doing in jail? Our report tonight at 7. #justheard #notmakingitup;NO
581;Parking incentives should be: 1. Bikes 2. Mopeds 3. Motorcycles 4. Electrics 5. 60+ mpg cars 6. 40+ mpg cars trucks 7. rest back of lot #fb;NO
582;Bestsellers buy it : #3: Kindle Fire 7, LCD Display, Wi-Fi, 8 GB - Includes Special Offers: Kindle Fire 7, LCD... http://t.co/x1nf6RDt;NO
583;ZJ Redman & Matsui in da mix at the last LoFi Jam Jam tonight!  ( LoFi - 429 Eastlake Ave Seattle wa )12-17-12 we move to The Baltic Room.;NO
584;CLEARED - firetrucks have left scene of reported carfire - NB 5 under convention center. That was quick;fire
585;FTC Says Mobile Apps for Kids ‘Aren’t Making The Grade’ - A biting new report from the U.S. Federal Trade Commission... http://t.co/zzAiwOwB;NO
586;Next bitch that talks about me, and uses my car accident against me, is gonna get curb stomped.;NO
587;Police Down Under rescue Apple map users: Australian police warn against using Apple Maps, Instagram pulls photo... http://t.co/Fyw8I4Wp;NO
588;Spokane Police extend search for murder suspect: SPOKANE -- Spokane Police are asking law enforcement a... http://t.co/ohicaRZ2 #seattle;NO
589;Green Car Journal wants to Kickstart 20th anniversary edition [w/video] - Autoblog (blog): Green Car Journal wan... http://t.co/VoqhDuYd;NO
590;In attempt to keep sailing rush going, ‘Admiral’ jumps car onto beach: A Chimacum man told police he pu... http://t.co/1a85UAQ0 #seattle;NO
591;officially gonna start saving for a new car.. this truck aint cuttin it;NO
592;Tacoma Fire De3partment replaces 3 fire engines with pickup trucks http://t.co/8tXLBxL0;NO
593;You know, that last tweet should read like this: Tacoma Fire Department replaces 3 fire engines with pickup trucks http://t.co/8tXLBxL0;NO
594;just a lab report and exam stand in my way of a much deserved three and a half week break;NO
595;Tacoma Fire Department replaces 3 fire engines with pickup trucks: TACOMA — Cutbacks within the Tacoma Fire... http://t.co/jPe2kuKG;NO
596;10 pounds of pot in Ore. traffic stop. 2 cited: KLAMATH FALLS, Ore. (AP) — Oregon State Police say two ... http://t.co/Yq2iS8g9 #seattle;NO
597;10 pounds of pot in Ore. traffic stop. 2 cited: Oregon State Police say two Richland, Wash., residents were cited... http://t.co/a4UN2mCi;NO
598;Government plans to cut whiplash injury claims - The Guardian http://t.co/mLg0WeJF;NO
599;Government plans to cut whiplash injury claims - The Guardian http://t.co/LQfiCG4b;NO
600;Auto Fire Alarm | 3642 33rd Av S | Units: E13 L3;fire
601;PostBusiness| Police: Apple Maps has dangerous Australian error: Police: Apple Maps has dangerous Australian err... http://t.co/wpqcDPM6;NO
602;BBC News UK Plans target bogus whiplash cases: Ministers unveil plans to reduce the number of whiplash claims fo... http://t.co/vdMx3Xc7;NO
603;Accident reported in EVERETT - 41st on-ramp to NB 5, left lane. Still backed up from north of SR 526 to Marine View Dr. Great;crash
604;stall reported, eb sr 16 to sb I-5, blocking right lane;crash
605;#5: Kindle Fire HD 8.9, Dolby Audio, Dual-Band Wi-Fi, 16 GB: Kindle Fire HD 8.9, Dolby Audio, Du... http://t.co/MNutoSlU #deals #sales;NO
606;When you feel like roads in life are blocked from u, what u do. One thing that comes to my mind is. #pray #patience;NO
607;The awkward moment when firemen burst into your building and find no fires... just bright eyes and appreciation. Hope they find the fire.;NO
608;Global and China CMOS Camera Module Industry Report, 2009-2010 – new market research report published http://t.co/YPZy0p21;NO
609;Whoever slanders to you about others, will slander about you.  And whoever reports to you, will soon report about you. Imam Ash-Shaafi’ee;NO
610;Deck the cars with bows - OCRegister: Deck the cars with bowsOCRegisterOn a cool December day, the sedans gleam ... http://t.co/IRn6xdTu;NO
611;BBC News UK Racist incidents increase by 10%: The number of racist incidents recorded by the police in Scotland ... http://t.co/gqPa45dB;NO
612;Cleanup begins as presumed tornado damages 40 Volusia homes: Most of the home damaged were inside an Terra Mar V... http://t.co/BFh37SWy;NO
613;Auto Fire Alarm | 510 24th Av S | Units: E6 L3;fire
614;Automatic Fire Alarm Resd | 3720 32nd Av W | Units: E41;fire
615;The backup due to the emergency construction on 5th Ave continues to be light as traffic remains heavy on the freeways into downtown.;NO
616;Bitterness is like #cancer. It eats upon the host. But anger is like fire. It burns it all clean.- Maya Angelou http://t.co/eFHh74ix;NO
617;Hmm. Haven't had a flashback scene for a few chapters or so. Maybe I need to throw one in to break this up a little. #amwriting #amediting;NO
618;For convenience, I have Quaker 45% less sugar oatmeal packets at work when I'm short on time. Um, my 1st bite was THE most sugary bite ever.;NO
619;For years Kentucky coal companies cut & pasted numbers from one pollution report to the next.  Fake Water Reports http://t.co/upvcel6i;NO
620;Follow up on the car driving dogs.... check out the video of them driving on the road...http://t.co/mdXllTgd;NO
621;Follow up on the car driving dogs.... check out the video of them driving on the road...http://t.co/mdXllTgd http://t.co/sEtvvwcT;NO
622;Richland police employee takes zap for United Way: Contributions to the United Way campaign from the Richland Police... http://t.co/n9GBGfb5;NO
623;#FunFact Torture doesn't work. Interrogation by police does. Put that in your TV & film torture fantasies pipe and smoke it. #fb;NO
624;Auto Fire Alarm | 6922 38th Av S | Units: E28 L12;fire
625;He just got in a car accident. He's stressed. Lol http://t.co/V8Pjx6sk;NO
626;Doctors' Group Reports Missing Laptop: Albuquerque television station KOB-TV reports (http://t.co/2hYrqfdp) that... http://t.co/MIkGgAsM;NO
627;Humphrey: BREAKING: Mother Duck and Ducklings Crossing a Busy Highway http://t.co/TnDvDGmO;NO
628;Space Wars: Break the Bricks: Break the Bricks: Space Wars sets a new standard for the genre as it is the most... http://t.co/aS1jpIq8;NO
629;Gas line break creates massive fireball in W. Va., no reported injuries http://t.co/d5XeMrhq;fire
630;Had a nice convo going with someone on Twitter and can't reply because they've blocked me. Thinking it was an accident but am stuck. *pouts*;NO
631;Check out this 2006 Freightliner C120 Highway Truck http://t.co/OMjnPWSr click for details;NO
632;Fire alarm goes off in library. No one moves. #finals;fire
633;Auto Fire Alarm | 11030 5th Av Ne | Units: E31 L5;fire
634;TV News story on Kickstart helping with critical steps in road to recovery for those with stroke and spinal cord injury http://t.co/wbBsAyWl;NO
635;NY police release shooting image: Police release an image of an assailant pulling a weapon moments before shooti... http://t.co/6dYe6Axf;NO
636;BBC News UK NY police release shooting image: Police release an image of an assailant pulling a weapon moments b... http://t.co/E5im28rP;NO
637;NYPD: Getaway car found in slaying of Calif. man: New York police say they've found the getaway car linked to th... http://t.co/qZNgzuPW;NO
638;The Lower Spokane Street Bridge has closed to vehicle traffic;NO
639;Americas Car Museum in Tacoma Washington http://t.co/nprcXMEi #lemay #car #show #vintage #hisory #muscle #cars;NO
640;The Lower Spokane Street Bridge has closed to vehicle traffic.;NO
641;Auto Fire Alarm | 306 6th Av S | Units: E5 L3;fire
642;Slumping Ravens fire offensive coordinator Cameron: Cam Cameron has been fired as offensive coordinator of the B... http://t.co/Gkqfnz4r;NO
643;sb I-5 express before Mercer, stall reported blocking left lane;crash
644;uh oh, something going on nb I-5 before 128th, traffic really jamming up;crash
645;Motor Vehicle Accident | 1st Av Ne / Ne 103rd St | Units: L5;crash
646;Looks like an incident NB I5 at 128th, blocking right lane.  Debris reported in all lanes.;crash
647;oh man, the dump truck trailer has overturned, nb I-5 before 128th, no wonder dirt & rocks are all over road;crash
648;Oh wow!  Got some more details.. overturned dump truck NB I5 before 128th, blocking right lane, dirt & rocks all over the road.;crash
649;A rolled-over double dump truck is blocking two lanes of NB I-5 at 128th St SW in South Everett. Watch live: http://t.co/oYJQvo1Q;crash
650;Campus shootings reported in Baltimore and Wyoming, yo that shit has to stop.;shooting
651;ONC Reports that Almost 50% of US Docs are E-Prescribing: According to a new report from the department of Healt... http://t.co/cT2ydkm5;NO
652;insure domestic Tranquility—pay taxes for police, fire, life safety, civil rights, national guard, disaster relief, forecasting;NO
653;With Two Billion Vehicles We Need More Automotive Podcasts Like This http://t.co/ShFjgTWk Talking electrics and LA auto show;NO
654;Weird. I think I just saw a truck pull up behind my parked car and take a picture. Flash went off and everything.;NO
655;Check out the BMW BASF M1 Pro Car hood we just got with the car. What a great design.Like/Share http://t.co/7hfUzZyz;NO
656;I'm gonna go outside. I'm gonna secretly smoke. I'm gonna come back reeking of smoke. I'm gonna be humiliated when people point it out.;NO
657;West Seattle Bridge EB at 4th, accident blocking BOTH lanes!;crash
658;Collision at NE 103rd St & 1st Ave NE southbound right lane blocked;crash
659;Fatal Crown Hill Fire still under investigation. Damage estimate at $150k. http://t.co/YL2Tq6rC;fire
660;Kindle Fire Manual: The Original Kindle Fire User Guide (Kindle Edition) newly tagged kindle fire:            ... http://t.co/YzagGLRK;NO
661;Finally got my SPD incident report that tells me nothing, surprise surprise!;NO
662;Video - NFL: FOX Sports reports some big injuries headed into Week 15.  http://t.co/zE2JpiE7;NO
663;Autopsy will help determine cause of last night's fatal Crown Hill fire: Fire investigators are waiting for the... http://t.co/DBAPqbqv;NO
664;The apartments in front of my house  caught on fire last night?! Daaamn;fire
665;3 arrested in last night's fatal shooting in Auburn http://t.co/6c76pjH4;shooting
666;3 arrested in last night's fatal shooting in Auburn: Three people have been arrested in connection with last night’s... http://t.co/wSk80V04;shooting
667;Yesterday I was driving a tiny car through FC3's jungle and got stuck on a rock. I jumped out of the car and was eaten by a TIGER.;NO
668;Reader reports that a lot of car windows were shot out near 24th/Lane yesterday: http://t.co/7FxObVeE;NO
669;Australian police warns: Google Maps are putting people’s lives at risk: Police in Colac, west of Melbourne, say... http://t.co/NzwkMDwm;NO
670;I just inquired of a nice used car in Florida & was told IN ALL CAPS that they don't ship cars;NO
671;American cars acting up all the time! Yeah I have one so I know! Asian cars don't acting up that often!;NO
672;really neat + simple photos showing you before/after NJ Sandy damage - swipe your mouse to uncover damage. http://t.co/O9vBxzaV;NO
673;California Attracts Cars of the Future - Voice of America: California Attracts Cars of the FutureVoice of Americ... http://t.co/Rv5byp2I;NO
674;Police arrest Bellingham carjacking suspect: BELLINGHAM, Wash. (AP) — Police have arrested a 28-year-ol... http://t.co/zCzLSVPC #seattle;NO
675;Police arrest Bellingham carjacking suspect: Police have arrested a 28-year-old man suspected of several crimes in... http://t.co/IHq03rm7;NO
676;Police arrest Bellingham carjacking suspect: Police have arrested a 28-year-old man suspected of severa... http://t.co/podIX7Zy #seattle;NO
677;Everybody see that lifestyle and think that's the life to live, the shits more than the money,the cars,the hoes nobody sees behind da scenes;NO
678;Automatic Fire Alarm Resd | 12322 16th Av Ne | Units: E39;fire
679;Auto Fire Alarm | 13737 15th Av Ne | Units: E24 L5;fire
680;I hate watching Final Destination... the Freeway Scene always Creeps me out.. aha Seriously tho...;NO
681;Unemployment has taught me that my dog has a fierce going with EVERY delivery truck that drives within 3 blocks;NO
682;Covercraft Custom Fit Sunbrella Series Vehicle Cover, Cadet Gray: Covercraft Custom Fit Sunbrella Series Vehicle... http://t.co/8o5QQLnn;NO
683;Sparklescent Mango 32 Ounce Quart Auto Air Color: SERIES 4500: Sparklescents & Sparkle Colors Auto Air Colors ar... http://t.co/wQ2IwoZJ;NO
684;Guess I should report that my car has in fact suffered a fractured brake pad which damaged the rotor. Nothing worse thank heaven.;NO
685;I just did an Irish Car Bomb. It went exactly how you'd think it'd go with me doing an Irish Car Bomb.;NO
686;12.12.12 #WOD DT Five rounds for time 45 # Deadlift, 12 reps 45 # Hang power clean, 9 reps 45 # Push jerk, 6 reps time 10mins #crossfit;NO
687;Dave Grohl burns more calories drumming during one song than most folks burn all day. #121212Concert;NO
688;Don't let one lil bump make the plane crash. Fight for it. Work through it. Go on.;NO
689;Corbett Report Radio 270 – Truth in the Academy? http://t.co/9da97byI The Corbett Report;NO
690;uhhh, why WOULDN'T we be jamming out to the New Kids On The Block Christmas album right now?;NO
691;ZAP Athletes Put Mark on Manchester Road Race: ZAP sent 5 athletes to the Manchester Road Race on Thanksgiving... http://t.co/arFFODot;NO
692;ZAP Athletes Put Mark on Manchester Road Race: ZAP sent 5 athletes to the Manchester Road Race on Thanksgiving... http://t.co/Ps1lz6Uf;NO
693;Booster car seat with back (Ballard): Giving away a car seat we've used as a nice, backed booster. From a non-sm... http://t.co/PaOcUOT9;NO
694;You ain't ever smoked no fire ??;NO
