695;Fuel-efficient cars threaten state finances - http://t.co/LUYu29U6: Fuel-efficient cars threaten state financesWN... http://t.co/OzklFagk;NO
696;Obviously, main point of #SeattleTimes article about pedestrian accidents is that  - THE ROADS ARE FOR CARS SO STAY THE FUCK OFF. #shocking;NO
697;Covercraft Custom Fit Sunbrella Series Vehicle Cover, Jet Black: Covercraft Custom Fit Sunbrella Series Vehicle ... http://t.co/VwchBh7Z;NO
698;I've never taken the high road, but I tell other people to, so there's more room for me on the low road.-Tom Haverford;NO
699;PintoTires1: Amico Waistband Graphics Auto Motor Decal Car / Truck Window Sticker - Beautiful Waistba... http://t.co/brlr49BM;NO
700;AP Video: UPS has developed a special lab to make sure their packages can withstand all the bumps in the road. http://t.co/lNuNzyV0;NO
701;New Internet usage report: A summary of Ofcom International report comparing consumer use of t... http://t.co/qThuwxGN #digitalmarketing;NO
702;NFL injury report: Seahawks RB Marshawn Lynch battles through back injury http://t.co/UmryaGo8;NO
703;Auto Fire Alarm | 12505 Greenwood Av N | Units: B4 E24 E31 L5;fire
704;‘Post-Industrial Journalism’ Report Deserves an A and an F: A new report from Columbia Journalism Sc... http://t.co/hEy87DeC #hyperlocal;NO
705;Can't pull into the parking garage at work...there's a dude blocking the entry eating his breakfast in the car. Good choice!;NO
706;I'll take Portland traffic over Seattle traffic any day;NO
707;When you live on a one way/lane road and fat ass semis decide its okay to block the whole road and you can't go anywhere #fuckyou;NO
708;Gets in car to take final at school ... Car doesn't start #backtobed #notcomplaining;NO
709;$25 for Motorized Lego-Inspired Building Blocks RC Car Set in 4 Color Options ($69 Value) http://t.co/FcktNeeN;NO
710;BreakBox: BreakBox is a free arcade ball game. Break all bricks with the ball and win! Break all bricks with the... http://t.co/7ykP93Me;NO
711;Traffic: Drivers watch out for patchy fog, slick roads: Overnight storms have left area roadways moist across th... http://t.co/3u40kvbw;NO
712;Automatic Fire Alarm Resd | 128 33rd Av E | Units: E34;fire
713;Clermont police chief stands by officer in shooting case: CLERMONT — Newly-sworn in police Chief Charles Broadwa... http://t.co/z9xwu0lm;NO
714;Scouting report: Seattle University: Scouting report: Seattle University Game info: 7 p.m. Thursday at KeyArena... http://t.co/UaxSL1bq;NO
715;Justin Bieber murder plot foiled by US police: Two men held by police were allegedly planning to castrate two me... http://t.co/lQ5E3Ggk;NO
716;Thursday Injury Report: DNP - Rice, Trufant, Chancellor, Bryant, Thurmond. LP - Lynch, Martin. http://t.co/ALJ41LFc;NO
717;Seahawks CB Walter Thurmond held out of practice Thursday with a hamstring injury. Story & injury report: http://t.co/VQYY2gO0;NO
718;Edm/King - One hour wait for vehicles in Edmonds for due to heavy traffic.   http://t.co/OdQaJnt2;NO
719;Front Porch: Police DUI emphasis patrols: Local police plan emphasis patrols throughout the holiday sea... http://t.co/KjgKm2Fp #seattle;NO
720;CLEARED in Pierce Co -  accident SB 5 near Gravelly Lake Dr, right shoulder. Slow appr scene;NO
721;I think the amount of time I've been watch movies on my laptop is going to break it. Or college is breaking all my electronics.;NO
722;Traffic sucks. Traffic when you have to piss like a racehorse is deadly... Cause I'm about to kill someone. #IWillPissOnYourCarDouche;NO
723;Fire causes $75K in damage at Lynnwood auto shop: LYNNWOOD -- A fire that started in an oil-change pit ... http://t.co/SqhuHbiL #seattle;fire
724;I guess someone's apartment caught on fire in my building. Lol.;fire
725;Car Tech's guide to using your Android phone in the car: Looking for tips on safely using your Android phone wit... http://t.co/fQbqYloA;NO
726;Cried watching nightly news as they report on innocent little children who have been shot or hit with shrapnel. Breaks my heart. #SadWorld;NO
727;the only advice to can have to people learning to do smoke tricks, is make the smoke your bitch.;NO
728;Report Contends 'Project Blitzkrieg' Threat Credible: Earlier reports of a planned, sophisticated attack on 30 U... http://t.co/VOlgXzbw;NO
729;Report Contends 'Project Blitzkrieg' Threat Credible: Earlier reports of a planned, sophisticated attack on 30 U... http://t.co/7ksNHPeD;NO
730;Girl shot on school bus. student held: A 13-year-old girl was fatally shot Tuesday morning on a private school b... http://t.co/ZYlpAHUg;shooting
731;Man shot in legs in West Seattle: A 17-year-old male was shot in the legs tonight in West Seattle. The man was shot... http://t.co/7hTUlpTL;shooting
732;Here is Thursday's injury report:SEAHAWKSDid not participate: WR Sidney Rice (foot), DB Marcus ... http://t.co/mLgLr4mQ SEATTLE SPORTS;NO
733;Rice, Thurmond unable to practice Thursday: Here is Thursday's injury report:SEAHAWKSDid not participate: WR S... http://t.co/OEVqxaM5;NO
734;Rice, Thurmond unable to practice Thursday: Here is Thursday's injury report: http://t.co/AbvqHxpQ;NO
735;Greece, NY Police officer Charged with Giving Alcohol to Minor, is Fired http://t.co/3jjWRq5A CopBlockOrg;NO
736;Judging by the bump back out of break, the union is still on the picket line against the #pac12 network.;NO
737;H. Stewart goes down with a painful-looking injury. PA plays James Brown's I feel good during injury TO. Hmm...;NO
738;Smoked out: Secondhand pot smoke raises concerns http://t.co/Q6xTUhyS;NO
739;#nowplaying Robyn - Crash And Burn Girl;NO
740;Smoked out: Secondhand pot smoke raises concerns: SEATTLE — Even for those who aren’t marijuana smokers, it may... http://t.co/Xxb2ageU;NO
741;Smoked out: Secondhand pot smoke raises concerns: SEATTLE — Even for those who aren’t marijuana smokers... http://t.co/zplP0ZnW #seattle;NO
742;911 + 311: 3 fire department 911 dispatches new on December 14 at 1:39 a.m.: 3 Fire department 911 dispatch... http://t.co/bJYs20Mf;NO
743;Tribal police kill 5 aggressive dogs: A tribal spokeswoman says Lower Elwha Klallam police have fatally shot five... http://t.co/rxupGCsm;NO
744;Tribal police kill 5 aggressive dogs: A tribal spokeswoman says Lower Elwha Klallam police have fatally... http://t.co/kLdplxKl #seattle;NO
745;UK car market defies predictions of triple-dip recession as Europe slumps: New UK car sales up 11.3% compared wi... http://t.co/ecIMf4oA;NO
746;Snohomish chief fought fires, floods, squabbles for 32 years: Mark Collins began his 36-year fire servi... http://t.co/9859vctG #seattle;NO
747;Crime Watch roundup (and more): Car stolen, car found, package-theft redux, plus 2 suspicious-person sightings http://t.co/PZBBAQph;NO
748;Corbett Report Radio 271 – The Global Crossroads http://t.co/utcD9mt6 The Corbett Report;NO
749;Crime Watch roundup (and more): Car stolen, car found, package-theft redux, plus 2 suspicious-perso... http://t.co/EahNIK0Q WEST SEATTLE;NO
750;Snohomish chief fought fires, floods, squabbles for 32 years: Mark Collins began his 36-year fire servi... http://t.co/SbUShLpf #seattle;NO
751;By the way analysts, this happened to me. My boss asked me to fire one of my analysts, told me if I didn't do it, I would be fired. Discuss.;NO
752;I'm taking another friday off, hoping for zero car accidents this time.;NO
753;Breaks my heart. School cafeteria worker fired for helping needy student http://t.co/xKLUUtyY;NO
754;I wonder if Traffic Engineers were elected,  maybe they would program traffic lights like their jobs depended on it?;NO
755;BREAKING:  Fire crews responding to a 3-alarm fire at the Greentree Apartments in Skyway.  Q13 has a news crew on the way.;fire
756;Something tells me that Adam crashed and burned after that press conference. Poor bb. #sleepybert &lt.3;NO
757;# of my friends saved by repsonsible gun owners = 0. # of my friends killed by legally obtained guns = 3 #guncontrol;NO
758;We will never ban guns in this country. This will always be a byproduct of that choice. We allow cars despite fatal accidents. It's the same;NO
759;#LetsPretend My name was wiz or big sean every1 would be bumping rollin down the highway http://t.co/AhxhC2CH;NO
760;WSP targeting vehicles driving unsafely around big trucks http://t.co/1uVuPjyU;NO
761;how do you provide reports to PPC clients? What form do you share information in? How efficient is it for you? #ppcchat #reporting;NO
762;Road #injury needs to be a priority alongside childhood diseases to help children & youth reach adulthood. #GBD2010;NO
763;Watching a string of sounds bites from kids at the scene. Innocence lost. So sad. #CTShooting;NO
764;Reports Developer - Crystal Reports  - Seattle, WA http://t.co/w5V05j3L;NO
765;Police: Calculator found in suspicious package at downtown bank: Seattle police discovered a calculator... http://t.co/2Bllc4i8 #seattle;NO
766;Luxury Cars HD: This app doest not need to internet . this app have HD luxury Cars collection. Luxury cars HD... http://t.co/kLH0K6SM;NO
767;Why It's Important for Electric Cars to Feel Familiar - Mashable: Why It's Important for Electric Cars to Feel F... http://t.co/PRRnKeEd;NO
768;Motor Vehicle Accident | N 130th St / Aurora Av N | Units: E24;NO
769;Reports confusing: one Lanza brother is suspected killer, one reported found dead, one questioned by police. #CTshooting;NO
770;Getting in a car wreck right before my final #goodomen;NO
771;Surgeon: Victims of this type of blast effect wound can continue to suffer damage 24-48 hours after being shot. #ClackamasShooting;NO
772;BREAKING: Gunman is 20-year-old Adam Lanza, NOT 24-year-old Ryan, who is his older brother and being questioned by police. #newtown;NO
773;Does your baby bump look good??! It will if you're the lucky winner of today's giveaway from Bump Maternity: http://t.co/cI4dKkeV;NO
774;#Seahawks RB Marshawn Lynch, regularly listed with a back injury, had FOOT added to the injury report today.  Was limited in practice.;NO
775;A weed house caught on fire in Renton this morning and the owners went to jail. Lol smh;fire
776;Firefighters save birds from house fire: Firefighters this morning saved a family's pet birds from a house fire ... http://t.co/GrvO12eq;fire
777;First the power goes out, then the building fire alarm goes off. Today does not seem like my day. #fb;fire
778;Small boat fire in Shilshole Marina: A small boat fire at Shilshole Marina this morning was quickly extinguished by... http://t.co/hGCO7OTy;fire
779;Shelton woman shot when she opens door: A Shelton woman was shot when she opened her door to two men early Wednesday. http://t.co/sjwhfcUk;shooting
780;Chicagoland: 2 Shot At Funeral For Shooting Victim: Today, two Chicago men were shot outside a funeral home on t... http://t.co/X48fEVLN;shooting
781;Police say a 17YO was shot in each leg in West Seattle tonight. His injuries are not life threatening. Shooter still on the loose.;shooting
782;Terrible news from Kansas City this morning. KC police: Chiefs player involved in shootings http://t.co/uE2ETvMi;shooting
783;Reports: Kansas City Chiefs Player Shoots, Kills Self: The shooting occurred early this morning at the team's tr... http://t.co/aDxmEmnp;shooting
784;Shots fired on the Ave today from a black Audi. Hopefully I don't become a suspect...;shooting
785;Walked by where the shooting took place in the U-District today less than an hour before it occurred.Thankful no one was hurt. Pray 4 the UD;shooting
786;UPDATE: Suspect arrested in shooting near UW: Seattle police say someone opened fire this afternoon in the 4300... http://t.co/KqEAfjuC;shooting
787;No injuries in shooting near University of Washington today. Here is a picture from scene of suspect's arrest: http://t.co/AiEbxVCm;shooting
788;Earlier in the week, I missed the UW shooting by a few seconds. Today, I missed someone with a gun at my work building. What the?;shooting
789;worst road rage this morning..why? woman w/ infant baby in car seat swerving cause she was on her phone, then girl w/ plate that said pooh;NO
790;How does a multi-tasker with car sickness get things done while riding along in a car for 6 hours today? Hmmm.;NO
791;Specials Wednesday! Part 2 of the 2 ton band's exclusive behind the scenes footage from the 2011 tour. Enjoy... http://t.co/zgDdbm5C;NO
792;Car accident update: The insurance company considers our car a total loss, so this morning I gave them my keys,... http://t.co/uL0r6TZD;NO
793;I leased a car today! Goodbye to the Volvo- only car Ive ever driven, hello brand new car with a warranty! #cartroubles;NO
794;Every local TV outlet and 6 police cars being parked outside my apartment probably means something incredibly wonderful happened here today.;NO
795;Not loving today's injury report. #Seahawks;NO
796;Sorry for not streaming lately, busy with a lot of work Planned to stream today but pc crashed. streaming this weekend and all winter break;NO
797;Why It’s Important for Electric Cars to Feel Familiar - If you think about it, the electric car is an incredible act... http://t.co/FHjiICLu;NO
798;May you burn in lake of fire you scum. Rot in hell for such a horrific massacre. Conn Families Seattle is behind you and sends prayers.;NO
799;HPV Infections May Return In Older Women: HPV (human papillomavirus) infection in women during or after menopaus... http://t.co/aYCM5rS7;NO
800;Sound bite driven politics is damaging USA long term interest.  Ambassador Rice could have helped gain lost ground in Africa from China.;NO
801;Driving my moms infinity makes me realize I could never own a sports car. Or a luxury car. #buthowdoyouNOTspeed?;NO
802;The Lower Spokane St bridge has been closed to vehicle traffic.;NO
803;#Seahawks injury report: DNP - Trufant (hammy), Rice (foot), Chancellor (groin), Bryant (foot), Thurmond (hammy). Limited - Lynch, Martin;NO
804;The Lower Spokane St bridge has been re-opened to vehicle traffic.;NO
805;From UW to downtown like this in a Police Charger wearing a HazMat Suit in traffic scaring people!!! http://t.co/f9DW4Veh;NO
806;Tacoma Police investigating mysterious shooting death David Watson left home early Sunday in search of his runaway dog. Watson, 45, found;shooting
807;SPD has released a redacted portion of the Katt Williams police report for the incident in Seattle on Sunday: http://t.co/pNu0owzx;NO
808;Report: Jeff Parke traded to Philadelphia: We first heard a report Sunday that Philadelphia was interested in... http://t.co/aGbs1Qn5;NO
809;No doubtfuls or questionables listed on injury report, so besides the 2 CBs ruled out, looking fairly decent for Sunday.;NO
810;Thurmond ruled out of game Sunday vs. Bills ... - The Seattle Times: Here is the final injury report going into ... http://t.co/KMM7Bm7k;NO
811;Seattle police increase patrols after Conn. school shooting: The Seattle Police Department is taking th... http://t.co/ishF5UQP #seattle;NO
812;The Lower Spokane St bridge will soon close to vehicle traffic.;NO
813;The captured shots of parents at the scene finding out their children didn't make it breaks my heart and makes me cry. #PrayForNewton;NO
814;Lower Spokane St bridge to be closed to vehicle traffic in about 5 minutes.;NO
815;I wish I was in a car going 90 instead of this bus that has to keep pulling over for cars to pass #longtriphome;NO
816;The Lower Spokane St bridge will be closing shortly to vehicle traffic.;NO
817;300 plays in 3 hours.  burn, baby, burn m/ http://t.co/6zMvl0bl http://t.co/awVJoSZj;NO
818;PostBusiness| Ocean Beauty recalls 2 types of smoked salmon: Ocean Beauty recalls 2 types of smoked salmon SEA... http://t.co/mc6MHzAI;NO
819;dude that guy who crashed the Pontiac is my hero I want to get chased by police ??????;crash
820;Labor Rights Group Urges Brands to Join Fire Safety Program After Deadly Fire at Factory Supplying US & European Brands http://t.co/UOQWO4AW;NO
821;My car dealership coming thru, way to go! Animals evacuated after fire find refuge at Mini Cooper dealership http://t.co/8nveGoE6;NO
822;Longview police need public’s help in copper thefts: LONGVIEW – Police in Longview need the public’s help to stop a... http://t.co/JygTGdEg;NO
823;Ten Cars That Are So Bad They're Cool - Jalopnik: Ten Cars That Are So Bad They're CoolJalopnikCars don't operat... http://t.co/70ojnvGd;NO
824;Another ARB outfitted truck for us to drool over. From our dealer Auto Fashion in Georgetown, Guyana. http://t.co/SX6zB1cC;NO
825;Donations needed for Chelan family burned out of home: CHELAN — A family of three who was burned out of... http://t.co/daGz9sGV #seattle;NO
826;The Spokane St bridge has re-opened to vehicle traffic.;NO
827;Our blog generates 55% more traffic for our clients listings.  More traffic = quicker sale and for higher $$$ – It pays to go with the...;NO
828;Now on scene of this apartment fire. Woman says she smelled smoke and started knocking on doors. Details coming. http://t.co/IkmixJs0;fire
829;nb I-5 before 128th, sounds like a dump truck loosing debris, and now blocking right lane, but stuff in all lanes;crash
830;2 right lanes now blocked, nb I-5 before 128th, rollover dump truck trailer;crash
831;Dump truck incident NB I5 at 128th (north of Lynnwood) is now blocking 2 right lanes.;crash
832;SWAT standoff closes Via Tuscany in Winter Park: A street in Winter Park is blocked off as police try to get in ... http://t.co/NOV603WT;crash
833;2 left lanes now blocked, sb I-5 before 175th, aid on scene;crash
834;A man was just shot in the legs outside our house. Cops and fire trucks everywhere. Moe is hating living here right now. Sucks.;shooting
835;I wonder how much twitter is going to blow up now about the gun fire in the bookstore #sketchseattle;shooting
836;Shots were fired by the #UW bookstore but thank God the suspect is arrested now! #BeSafe y'all;shooting
837;Police now reporting suspect had a low-caliber weapon, possibly a BB gun. In fairness, the BB is the lowest of calibers.;shooting
838;Huh.  Is it a bad sign that the police report on my traffic accident is now two days overdue?;NO
839;2013 is promising, I have Graduation. Being Famous. Fixing my Car. I'm loving my life so far. Thanks god. & I'm still gay(: smoke weed!;NO
840;The rain & this freeway traffic is not what the fuck's up right now. Can't stand these Seattle drivers;NO
841;I turned prison break off it pissed me off .. Now I'm listening to jalens city Stocktons police radio.. #11 most view in US.................;NO
842;Automakers report strong sales last month: Ford, Chrysler, Nissan, Hyundai post big gains U.S. auto sales in Nov... http://t.co/ivvMGiWX;NO
843;BREAKING: Scumville fires or trades everyone on their current roster for allocation money and the rights to your first born child.;NO
844;Reports: 2013 Ford C-Max Hybrid, Fusion Hybrids Fail To Meet EPA Ratings: Two of Detroit’s newest hybrid vehicle... http://t.co/YlpSw8j1;NO
845;The Seattle Fire Dept. says a new fire prevention fee and other changes will take effect on January 1, 2013: http://t.co/lwjhwqyo;NO
846;My wife just drove 10 miles down a highway at 70mph with an iPad on the roof of the car. It did not fall off. #christmasmiracles;NO
847;Finals are this week, then winter break, never been so excited about a break since high school.;NO
848;Winter car safety: Winter driving is fraught with potential accidents. It is vital to be extra careful, especial... http://t.co/ScOwjS6r;NO
849;First weekday of winter break and I'm so sick I feel I was hit by a truck. #notfair;NO
850;GameStop now stocking Kindle Fire tablets, handing out free virtual bucks with purchase:   The Kindle Fire line ... http://t.co/yXefa4Qz;NO
851;Google Maps now available on App Store, some report downloading issues: As reported earlier tonight, Google ha... http://t.co/2iTjvq7j;NO
852;Layin on the couch watching prison break alone.. Winter break feels an awful lot like fall quarter.;NO
853;Report: Winter Park High locked down over Facebook  post: http://t.co/N1oxT2i4 is reporting that Winter Park High... http://t.co/tYKmmYdr;NO
854;HANK: Molly’s Hours During Winter Break: With the holidays coming up and UW on Winter Break, Molly’s will begin ... http://t.co/OlIJhwz9;NO
855;Peanut butter & peach jam sandwich is ... interesting. And needs more jam. (Yes it's 2 and I'm just now getting to eat my lunch.);NO
856;I really miss having a winter break. Like a month long winter break opposed to a measly 2 days. #work;NO
857;Earnhardt Jr. gives 2013 car solid review at test - Brad Keselowski drives his car during testing for the NASCAR Spr... http://t.co/FrGBVtqJ;NO
858;Woke up and didn't get snow. Kinda sad, kinda happy. Now I can drive around and not have the chance of wrecking my car.;NO
859;The Lower Spokane St bridge is now closed to vehicle traffic.;NO
860;It pisses me off to no end that my brother sold my car to pay for his college so I now don't have a car.;NO
861;Chilly, nippy wind... Gray skies, no sun... Threat of a bit of snow, people freaked... Bus ride, a scene from Contagion... #winterinseattle;NO
862;Fred Jackson Injury: Updates on Bills RB's Knee | Bleacher Report (via http://t.co/g4GZWbXP) http://t.co/Z2RpFjGK;NO
863;Traffic: we are seeing some slowing NB 167 from Auburn through Kent due to an earlier crash - plan on an extra 10-15 minutes;NO
864;Front Porch: County burn ban downgraded: A burn ban imposed by the Puget Sound Clean Air Agency has bee... http://t.co/YmDuJNBE #seattle;NO
865;Troopers and road crews work hard to keep U.S. 2 safe: A WSDOT truck checks for slides over U.S. 2 caus... http://t.co/eRadjAEA #seattle;NO
866;UW ALERT: SHOTS FIRED:Report of shots fired at the University Book Store, 4326 University Way NE, Veh fled from scene, Blk Audi;shooting
867;UW ALERT: SHOTS FIRED:Report of shots fired at the University Book Store, 4326 University Way NE, Veh fled from scene, Blk Audi;shooting
868;UW ALERT: SHOTS FIRED:Report of shots fired at the University Book Store, 4326 University Way NE, Veh fled from scene, Blk Audi;shooting
869;U-Dstrict shooting suspect in custody according to Seattle Police;shooting
870;A man fired shots right through the window of a clothing store in the UDistrict today. Full story at 5pm. Livestream: http://t.co/F5azUNdl;shooting
871;Accident reported in Bothell - SB 405 before SR 527, right lane. Already looks slow from nearly I-5;crash
872;Crash blocks the right lane SB 405 north of 527 or south of I-5, however you want to look at it. Backup from I-5.;crash
873;Fire in Building | 1222 Taylor Av N | Units: A2 AIR9 B4 B6 DEP1 E10 E2 E25 E5 E8 L4 L6 M1 SAFT2 STAF10;fire
874;REPORTED FIRE IN BUILDING 1222 TAYLOR AV N 1222 TAYLOR AV N http://t.co/6oeEvuqE;fire
875;Fire in Building | 1222 Taylor Av N | Units: M1;fire
876;Nooo!! EB 520 before 405, an accident partially blocking the left lane, also SB I5 Express Lanes near Mercer, stall in left lane!;crash
877;Accident reported in Kirkland - NB 405 north of 85th, HOV lane...;crash
878;Update in Kirkland - accident NB 405 just north of 85th, HOV lane. Aid on scene. Slow from 520;crash
879;Crash partially blocking the SB 5 on ramp from SR 518.;crash
880;Police investigate woman who damaged 529 bridge with SUV: EVERETT -- Police are investigating whether a... http://t.co/15jdjP9u #seattle;crash
881;CLEARED in Tukwila - accident EB 518 to SB 5. Slow appr scene;crash
882;Police investigate woman who damaged 529 bridge with SUV: EVERETT -- Police are investigating whether a... http://t.co/RdfaZvlw #seattle;crash
883;Police investigate woman who damaged 529 bridge with SUV: EVERETT -- Police are investigating whether a... http://t.co/gmKGFLZF #seattle;crash
884;Highway 529 bridge to reopen this afternoon: The northbound Highway 529 bridge connecting Everett and M... http://t.co/YVyxqEtl #seattle;crash
885;Highway 529 bridge reopens: The northbound Highway 529 bridge connecting Everett and Marysville reopene... http://t.co/o3noK3q6 #seattle;crash
886;Highway 529 bridge reopens: The northbound Highway 529 bridge connecting Everett and Marysville reopene... http://t.co/ji6w2im8 #seattle;crash
